{
  "recordKind": "open_instrument_static_provider_result_import_quarantine",
  "schemaVersion": "0.1",
  "sourceRecordRef": "docs/open-instrument/open-instrument-first-controlled-local-provider-execution-one-shot-local-only-record-v0.1.md",
  "sourcePr": 1442,
  "sourceMergeSha": "0cfc7b6a8520af302f95020638005a2d80c86d15",
  "providerName": "ollama",
  "modelName": "llama3.1:8b",
  "endpointIdentity": "http://127.0.0.1:11434/api/generate",
  "localEndpointProofSha256": "6e82b917ab7a55d0b9a9f22e6d02f9ce7a843643a276726722bf6a0ee0a3b033",
  "promptSha256": "c423e701b6c9c5868b0fb0d2bae3760aaf39db0c06a89b664293d35a37df347b",
  "requestBodySha256": "cf1c5c6662d008f0af78cdbc89936875b6dae6515d74cca9b2fa725c7f53ad37",
  "responseSha256": "4ed28de890a82de2106400038b5115ef34a1bf11e6df273f7eac0ed51983ebda",
  "executionCount": 1,
  "requestCount": 1,
  "responseCaptureCount": 1,
  "retryCount": 0,
  "rerunCount": 0,
  "importStatus": "static_import_validated",
  "quarantineStatus": "quarantined_candidate_only",
  "candidateOnlyStatus": "candidate_only_retained",
  "evidencePromotionStatus": "evidence_promotion_blocked",
  "publicationStatus": "publication_blocked",
  "providerOutputScoringStatus": "provider_output_scoring_blocked",
  "candidateRankingStatus": "candidate_ranking_blocked",
  "runtimeApiUiWiringStatus": "runtime_api_ui_wiring_blocked",
  "secretStatus": "secrets_absent",
  "blockedEvidenceClasses": [
    "provider_output_evidence",
    "parser_compatibility_evidence",
    "reproducibility_evidence",
    "candidate_truth_evidence",
    "origin_evidence",
    "model_quality_evidence",
    "publication_evidence",
    "execution_safety_evidence"
  ],
  "nonExecutionStatement": {
    "providerExecutionStatus": "provider_execution_not_authorized",
    "modelCallStatus": "model_call_not_authorized",
    "paidOpenAiApiStatus": "paid_openai_api_not_authorized",
    "remoteEndpointStatus": "remote_endpoint_not_authorized",
    "localhostCallStatus": "localhost_call_not_authorized",
    "ollamaCallStatus": "ollama_call_not_authorized",
    "openAiCompatibleEndpointStatus": "openai_compatible_endpoint_not_authorized",
    "retryStatus": "retry_not_authorized",
    "rerunStatus": "rerun_not_authorized"
  },
  "notes": [
    "Static import quarantine record for the previously recorded first controlled local-provider result.",
    "The provider result remains candidate-only.",
    "Evidence promotion is blocked.",
    "Publication, provider-output scoring, candidate ranking, runtime/API/UI wiring, retry, rerun, and new provider execution are blocked.",
    "No raw provider-output text is imported by this fixture.",
    "Zheji replay is outside this lane.",
    "Consonant frame extraction is outside this lane.",
    "Y remains one of the seven canonical ZË-RO vowels and is not treated as consonantal by default."
  ]
}
